LGND-USA,PGNX-USA,ILMN-USA,SPPI-USA,ENDP-USA,ARWR-USA,BDSI-USA,TECH-USA,REGN-USA,SIGA-USA
 1/09/2020 LGND-US   BW   Ligand to Report 2019 Fourth Quarter and Full Year Financial Results on February 6th," 1/06/2020 PGNX-US     BW   INVESTIGATION REMINDER: The Schall Law Firm Announces it is Investigating Claims Against Progenics Pharmaceuticals, Inc. and Encourages Investors with Losses in Excess of $100,000 to Contact the Firm", 9:00a     0KYC2K-E    BW   Illumina Files Patent Infringement Suits Against BGI in Sweden and the United Kingdom,12/26/2019 84763A10  BW   Spectrum Pharmaceuticals Provides Pipeline Update on Late Stage Programs," 1/12/2018 ENDP-US  BW   Glancy Prongay & Murray LLP Reminds Investors of the January 16, 2018 Deadline in the Class Action Lawsuit Against Endo International, PLC (ENDP)", 1/06/2020 ARWR-US  BW   Arrowhead Pharmaceuticals Appoints James Hassard as Chief Commercial Officer,10/09/2019 BDSI-US  BW   Calidi Biotherapeutics Announces Appointment of Seasoned Biotech Executive George Ng to Board of Directors,#N/A," 4/08/2019 ALNY-US  BW   Alnylam and Regeneron Announce Broad Collaboration to Discover, Develop and Commercialize RNAi Therapeutics Focused on Ocular and Central Nervous System (CNS) Diseases",11/16/2016 SIGA-US  BW   SIGA Announces Successful Completion of Rights Offering; Funding of Loan; Completion of Payment of PharmAthene Obligation
12/23/2019 LGND-US   BW   Two Ligand Pharmaceuticals Board Members Recognized as 2019 Most Influential Corporate Directors by WomenInc. Magazine,"12/20/2019 PGNX-US     BW   INVESTIGATION ALERT: The Schall Law Firm Announces it is Investigating Claims Against Progenics Pharmaceuticals, Inc. and Encourages Investors with Losses in Excess of $100,000 to Contact the Firm"," 1/06/2020 0JGNNP-E    BW   NuProbe Global and CarrierGene Biotech Co. Ltd. Announced Completion of Merger, Appointed Yingshuang Chai as CEO, and Established Collaboration with Illumina",11/14/2019 84763A10  BW   Spectrum Pharmaceuticals to Present Corporate Update at the Jefferies 2019 London Healthcare Conference on November 21st," 1/08/2018 ENDP-US  BW   ENDP INVESTOR ALERT: Law Offices of Howard G. Smith Announces the Filing of a Securities Class Action on Behalf of Endo International, PLC Investors",12/20/2019 ARWR-US  BW   Arrowhead Pharmaceuticals Doses First Patient in AROAAT2002 Open Label Phase 2 Study of ARO-AAT for Treatment of Alpha-1 Liver Disease,"11/02/2017 0BGL4K-E BW   SHAREHOLDER ALERT: Levi & Korsinsky, LLP Announces an Investigation Concerning Possible Breaches of Fiduciary Duty by BioDelivery Sciences International, Inc.",#N/A, 8/16/2018 REGN-US  BW   Teva and Regeneron Announce Positive Topline Phase 3 Fasinumab Results in Patients with Chronic Pain from Osteoarthritis of the Knee or Hip,10/21/2016 SIGA-US  BW   SIGA Announces Commencement of Rights Offering
12/02/2019 LGND-US   BW   Ligand Enters into Worldwide OmniAb® Platform License Agreement with Sanofi,11/08/2019 0LDDK2-E    BW   Velan Receives Requisite Number of Written Consents to Reconstitute Majority of Progenics Board, 1/02/2020 45232710    BW   Illumina and Pacific Biosciences Announce Termination of Merger Agreement,11/07/2019 84763A10  BW   Spectrum Pharmaceuticals Reports Third Quarter 2019 Financial Results and Pipeline Update," 1/05/2018 ENDP-US  BW   ENDO INTERNATIONAL LEAD PLAINTIFF DEADLINE ALERT: Faruqi & Faruqi, LLP Encourages Investors Who Suffered Losses Exceeding $100,000 In Endo International, PLC. To Contact The Firm",12/16/2019 ARWR-US  BW   Arrowhead Pharmaceuticals Reports Inducement Grants under NASDAQ Marketplace Rule 5635(c)(4)," 2/28/2013 09060J10 BW   INVESTOR ALERT: Former Attorney General of Louisiana and Kahn Swick & Foti, LLC Investigate BioDelivery Sciences International, Inc., Following Notice of Non-Reliance of Financial Statements and Restatement",#N/A," 8/06/2018 BLUE-US  BW   bluebird bio and Regeneron Announce Collaboration to Discover, Develop and Commercialize New Cell Therapies for Cancer","10/13/2016 003Q3K-E BW   SIGA Announces Dr. Phil Gomez Joins Company as New CEO, Dr. Eric Rose to Serve as Executive Chairman of the Board"
11/12/2019 05MFY1-E  BW   Ligand Pharmaceuticals Ranked in Deloitte’s 2019 Technology Fast 500™,11/07/2019 LNTH-US     BW   Lantheus Releases Comprehensive Strategic Plan for Progenics,12/23/2019 45232710    BW   Illumina to Webcast Upcoming Investor Conference Presentation,10/31/2019 84763A10  BW   Spectrum Pharmaceuticals Announces Third Quarter 2019 Financial Results Conference Call," 1/03/2018 ENDP-US  BW   Glancy Prongay & Murray Announces Filing of a Securities Class Action on Behalf of Endo International, PLC Investors and Encourages Investors to Contact the Firm",12/16/2019 ARWR-US  BW   Arrowhead Pharmaceuticals Files for Regulatory Clearance to Begin Phase 1 Study of ARO-HSD for Treatment of Alcohol and Nonalcohol Related Liver Disease," 1/17/2013 09565S-E BW   Research and Markets: Chemotherapy Induced Nausea and Vomiting - Pipeline Review, H2 2012",#N/A,10/16/2017 AIMT-US  BW   Aimmune Therapeutics Announces Clinical Collaboration to Study AR101 with Regeneron and Sanofi’s Dupilumab for Peanut Allergy,10/10/2016 SIGA-US  BW   SIGA Announces Oct. 12 Record Date for Rights Offering
11/08/2019 LGND-US   BW   Ligand Presents Positive Results from Phase 1 Clinical Trial of Captisol-enabled Iohexol,11/04/2019 PGNX-US     BW   Glass Lewis Recommends Stockholders Vote on GREEN Consent Card for Velan Nominees to Constitute Majority of Progenics Board,12/19/2019 000KYD-E    BW   Denodo Announces Winners of Second Annual Data Innovation Award During Datafest 2019,10/24/2019 84763A10  BW   Spectrum Pharmaceuticals Announces Submission to the U.S. Food and Drug Administration of Updated Biologics License Application for ROLONTIS®,12/23/2017 ENDP-US  BW   SHAREHOLDER ALERT: Pomerantz Law Firm Reminds Shareholders with Losses on Their Investment in Endo International plc of Class Action Lawsuit and Upcoming Deadline – ENDP,12/13/2019 ARWR-US  BW   Arrowhead Pharmaceuticals Appoints Marianne De Backer to Board of Directors, 2/08/2011 09060J10 BW   BioDelivery Sciences to Present at the 13th Annual BIO CEO & Investor Conference,#N/A, 6/19/2017 VEEV-US  BW   Standardizing on Veeva Vault Enhances Regeneron’s Clinical and Regulatory Operations Processes, 9/21/2016 06ZQG4-E BW   SIGA Announces Bankruptcy Court Approval of Transaction Under Which SIGA Will Pay PharmAthene Claim in Full
11/07/2019 LGND-US   BW   Ligand to Participate in the Stephens 2019 Nashville Investment Conference,10/28/2019 0LDDK2-E    BW   ISS Recommends Shareholders Vote on the GREEN Consent Card for Election of Velan Nominees and Removal of Progenics CEO,11/20/2019 45232710    BW   Illumina to Webcast Upcoming Investor Conference Presentations,10/09/2019 BDSI-US   BW   Calidi Biotherapeutics Announces Appointment of Seasoned Biotech Executive George Ng to Board of Directors,12/05/2017 ENDP-US  BW   Robbins Arroyo LLP: Endo International plc (ENDP) Misled Shareholders According to a Recently Filed Class Action,12/11/2019 ARWR-US  BW   Arrowhead Pharmaceuticals Files IND for Phase 1b Study of ARO-HIF2 for Treatment of Clear Cell Renal Cell Carcinoma, 1/21/2011 008SRQ-E BW   BioDelivery Sciences Refutes Patent Claim,#N/A," 1/23/2017 UGNEQ-US BW   Aerie Pharmaceuticals Announces Appointment of Kristine Erickson, O.D., Ph.D., as Vice President Clinical Research", 8/29/2016 SIGA-US  BW   SIGA Announces Completion of Enrollment and Dosing in the Final Cohort of Phase III Study of TPOXX™ (tecovirimat)
11/05/2019 LGND-US   BW   Ligand Reports Third Quarter 2019 Financial Results,10/24/2019 0LDDK2-E    BW   Independent Director Candidates Nominated by Velan Issue Letter to Progenics Shareholders,10/24/2019 45232710    BW   Illumina Reports Financial Results for Third Quarter of Fiscal Year 2019,10/04/2019 84763A10  BW   Spectrum Pharmaceuticals Announces Publication of Positive Poziotinib Data in Cancer Cell,"11/15/2017 ENDP-US  BW   ENDO INTERNATIONAL INVESTOR ALERT: Faruqi & Faruqi, LLP Encourages Investors Who Suffered Losses Exceeding $100,000 Investing in Endo International, Plc to Contact the Firm",12/06/2019 ARWR-US  BW   Arrowhead Pharmaceuticals Closes Underwritten Public Offering with Gross Proceeds of $266.8 Million, 1/06/2011 05WV00-E BW   BioDelivery Sciences Hires Head of Manufacturing Operations,#N/A,10/17/2016 06CR5C-E BW   Regeneron and Teva Provide Update on Fasinumab Clinical Development Programs, 8/08/2016 SIGA-US  BW   SIGA Announces Data Safety Monitoring Board (DSMB) Approval to Complete Subject Enrollment in the Final Cohort of Phase III Study of TPOXX™ (tecovirimat)
10/22/2019 LGND-US   BW   Ligand to Report Third Quarter 2019 Results on November 5th,10/23/2019 PGNX-US     BW   Velan Responds to Misleading Communications from Progenics,"10/08/2019 45232710    BW   Illumina to Announce Third Quarter 2019 Financial Results on Thursday, October 24, 2019", 9/25/2019 84763A10  BW   Spectrum Pharmaceuticals to Present Corporate Update at the 2019 Cantor Global Healthcare Conference on October 2nd," 9/25/2017 ENDP-US  BW   The Klein Law Firm Reminds Investors of a Class Action Filed on Behalf of Endo International plc Shareholders and a Lead Plaintiff Deadline of October 17, 2017",12/04/2019 ARWR-US  BW   Arrowhead Pharmaceuticals Announces Pricing of Underwritten Public Offering of Common Stock,12/09/2010 09060J10 BW   BioDelivery Sciences Announces Enrollment of the First Patient in the Phase 3 BEMA Buprenorphine Clinical Program,#N/A,10/13/2016 06CR5C-E BW   Ocular Therapeutix™ and Regeneron Enter Into Strategic Collaboration to Develop Sustained Release Formulation of Aflibercept for the Treatment of Wet AMD and Other Serious Retinal Diseases, 4/25/2016 SIGA-US  BW   SIGA Announces Enrollment of First Patients in the Final Cohort of Phase III Study of Tecovirimat
10/15/2019 LGND-US   BW   Ligand Appoints Pharmaceutical Executive Sarah Boyce to its Board of Directors,10/22/2019 PGNX-US     BW   Velan Sends Letter to Progenics Stockholders,10/07/2019 ILMN-US     BW   QIAGEN and Illumina Partner to Deliver Sequencing-Based In-Vitro Diagnostic (IVD) Tests, 9/06/2019 84763A10  BW   Spectrum Announces Poziotinib Data Being Presented at the IASLC 2019 World Conference on Lung Cancer," 9/20/2017 ENDP-US  BW   ENDP INVESTOR ALERT: The Law Offices of Vincent Wong Reminds Investors of Commencement of a Class Action Involving Endo International plc and a Lead Plaintiff Deadline of October 17, 2017",12/02/2019 ARWR-US  BW   Arrowhead Pharmaceuticals Announces Proposed Underwritten Offering of Common Stock,11/23/2010 09060J10 BW   BioDelivery Sciences Announces Resumption of ONSOLIS Manufacturing,#N/A," 9/20/2016 REGN-US  BW   Teva and Regeneron Announce Global Collaboration to Develop and Commercialize Fasinumab, an Investigational NGF Antibody for Chronic Pain", 4/12/2016 SIGA-US  BW   SIGA Emerges from Chapter 11 Bankruptcy Protection
 8/29/2019 LGND-US   BW   Ligand to Participate in the H. C. Wainwright 21st Annual Global Investment Conference,10/21/2019 PGNX-US     BW   Velan Issues Presentation Outlining Nominees’ Comprehensive Strategic Plan to Save Progenics,10/07/2019 ILMN-US     BW   QIAGEN und Illumina gehen Partnerschaft zur Einführung sequenzierungsbasierter In-vitro-Diagnostik-Tests ein, 9/03/2019 84763A10  BW   Spectrum Pharmaceuticals to Present at Two Upcoming Investor Conferences in September," 9/18/2017 ENDP-US  BW   EQUITY ALERT: Levi & Korsinsky, LLP Reminds Shareholders It Filed a Complaint to Recover Losses Suffered by Investors in Endo International plc and Set a Lead Plaintiff Deadline of October 17, 2017",11/26/2019 ARWR-US  BW   Arrowhead Pharmaceuticals to Participate in Upcoming December 2019 Conferences,"11/12/2010 09060J10 BW   BioDelivery Sciences to Hold Investor Conference Call on Monday, November 15, 2010",#N/A,11/24/2015 REGN-US  BW   ERS Genomics Licenses Genome-Editing Patents to Regeneron Pharmaceuticals, 3/17/2016 SIGA-US  BW   SIGA Commences Clinical Study for Intravenous (IV) Formulation of TPOXX
 8/12/2019 LGND-US   BW   Ligand Partner CASI Pharmaceuticals Launches EVOMELA® in China,10/08/2019 PGNX-US     BW   Velan Sends Letter to Progenics Pharmaceuticals Stockholders and Files Definitive Consent Statement,10/07/2019 45232710    BW   Illumina and QIAGEN Partner to Deliver Sequencing-Based In-Vitro Diagnostic (IVD) Tests, 8/08/2019 84763A10  BW   Spectrum Pharmaceuticals Reports Second Quarter 2019 Financial Results and Pipeline Update, 9/18/2017 ENDP-US  BW   IMPORTANT SHAREHOLDER ALERT: Khang & Khang LLP Announces Securities Class Action Lawsuit against Endo International plc and Encourages Investors with Losses to Contact the Firm,11/25/2019 ARWR-US  BW   Arrowhead Pharmaceuticals Reports Fiscal Year 2019 Results,11/10/2010 09060J10 BW   BioDelivery Sciences to Present at Lazard and Piper Jaffray Investor Conferences,#N/A,11/20/2015 06NNTP-E BW   Regeneron’s Dr. George D. Yancopoulos Elected to Cold Spring Harbor Laboratory Board of Trustees, 3/15/2016 SIGA-US  BW   SIGA Technologies Engages PiperJaffray as Financial Advisor
 7/30/2019 LGND-US   BW   Ligand Reports Second Quarter 2019 Financial Results,"10/03/2019 PGNX-US     BW   PROGENICS INVESTOR ALERT by the Former Attorney General of Louisiana: Kahn Swick & Foti, LLC Investigates Adequacy of Price and Process in Proposed Sale of Progenics Pharmaceuticals, Inc. - PGNX", 9/30/2019 45232710    BW   Illumina and Broad Institute Announce Agreement to Co-Develop Genomic Secondary Analysis Tools, 8/01/2019 84763A10  BW   Spectrum Pharmaceuticals Announces Second Quarter 2019 Financial Results Conference Call, 9/15/2017 ENDP-US  BW   ENDO LOSS NOTICE: Rosen Law Firm Reminds Endo International plc Investors of Important Deadline in Class Action – ENDP,11/18/2019 ARWR-US  BW   Arrowhead Presents New Clinical Data on Cardiometabolic Candidates ARO-APOC3 and ARO-ANG3 at AHA Scientific Sessions 2019,10/27/2010 09060J10 BW   BioDelivery Sciences Announces Positive End-of-Phase 2 Meeting with FDA for BEMA Buprenorphine in Chronic Pain,#N/A," 7/08/2015 0B17BB-E BW   Kendall Law Group Investigating Potential Breaches of Fiduciary Duties By Regeneron Pharmaceuticals, Inc. (REGN) Officials on Behalf of Shareholders", 2/24/2016 06CR5C-E BW   FDA Concurs on Clinical Dose for SIGA’s Tecovirimat Antiviral
" 7/23/2019 LGND-US   BW   Ligand Acquires Ab Initio Biotherapeutics, an Antigen-Discovery Company",10/02/2019 PGNX-US     BW   Velan Comments on Announced Sale of Progenics to Lantheus, 9/23/2019 45232710    BW   Illumina Names Joydeep Goswami Senior Vice President of Corporate Development and Strategic Planning, 7/22/2019 84763A10  BW   Spectrum Announces Expansion of the Poziotinib Clinical Program, 9/15/2017 ENDP-US  BW   IMPORTANT INVESTOR ALERT: Lundin Law PC Announces Securities Class Action Lawsuit against Endo International plc and Encourages Investors with Losses to Contact the Firm,11/15/2019 ARWR-US  BW   Arrowhead Pharmaceuticals Announces Planned Management Transition,10/20/2010 09060J10 BW   BioDelivery Sciences and Meda Announce European Approval of BEMA Fentanyl (BREAKYL),#N/A, 5/21/2013 ALCLS-FR BW   Cellectis : Compact TALENTM : La nouvelle génération de nucléases effectrices TAL,12/23/2015 SIGA-US  BW   SIGA Announces That Delaware Supreme Court Affirms Court of Chancery Opinion
 7/15/2019 LGND-US   BW   Ligand to Report Second Quarter 2019 Results on July 30th,10/02/2019 LNTH-US     BW   Lantheus to Acquire Progenics to Form a Leading Precision Diagnostics Imaging and Therapeutics Company, 9/12/2019 45232710    BW   Illumina Recommends Stockholders Reject Mini-Tender Offer by TRC Capital Corporation, 6/20/2019 84763A10  BW   Spectrum Pharmaceuticals Appoints Elizabeth Czerepak to its Board of Directors, 9/15/2017 ENDP-US  BW   SHAREHOLDER ALERT: Goldberg Law PC Announces the Filing of a Securities Class Action Lawsuit against Endo International plc,11/11/2019 ARWR-US  BW   Arrowhead Pharmaceuticals to Webcast Fiscal 2019 Year End Results,10/07/2010 09060J10 BW   BioDelivery Sciences Announces Commercial Partnership for BEMA Fentanyl in Taiwan,#N/A,"10/17/2012 000KXY-E BW   Genentech’s Lucentis 0.3mg for Diabetic Macular Edema Has Experienced Robust Trial and Uptake During the First Month of Commercial Availability, According to a Recent BioTrends Report",12/15/2015 SIGA-US  BW   SIGA Files Consensual Plan of Reorganization
 7/10/2019 LGND-US   BW   Ligand Announces Positive Top Line Results from Phase 1 Clinical Trial of Captisol-enabled Iohexol," 9/18/2019 0LDDK2-E    BW   Velan Launches Consent Solicitation to Reconstitute the Progenics Board With Its Five Highly-Qualified, Independent Director Nominees", 7/29/2019 45232710    BW   Illumina Reports Financial Results for Second Quarter of Fiscal Year 2019, 6/02/2019 84763A10  BW   Spectrum Pharmaceuticals Announces Integrated Results from Two Phase 3 ROLONTIS® (eflapegrastim) Trials Being Presented at the ASCO Annual Meeting," 9/15/2017 ENDP-US  BW   The Klein Law Firm Notifies Investors of Commencement of a Class Action Filed on Behalf of Endo International plc Shareholders and a Lead Plaintiff Deadline of October 17, 2017",11/08/2019 ARWR-US  BW   Arrowhead and Collaborator Janssen Present Phase 2 Clinical Data for Investigational Hepatitis B Regimens at The Liver Meeting® 2019," 9/08/2010 09060J10 BW   BioDelivery Sciences to Present at Rodman & Renshaw, Baird, and Stifel Nicolaus Investor Conferences",#N/A," 7/04/2012 REGN-US  BW   Research and Markets: Regeneron Pharmaceuticals, Inc.: Pharmavitae 2012 Report - Approval for Eylea Is Expected In the EU in Late 2012 or Early 2013", 3/18/2015 82691710 BW   SIGA Technologies Receives NASDAQ Delisting Notification
 7/08/2019 LGND-US   BW   Ligand and SQ Innovation Enter into Exclusive Worldwide Captisol® License and Supply Agreements for High-Concentration Furosemide Formulation," 6/21/2016 07J4DM-E    BW   Progenics Pharmaceuticals, Inc. Signs Commercial License Agreement with Selexis SA for Use of Proprietary Cell Line and SUREtechnology Platform"," 7/16/2019 45232710    BW   Illumina Expands Genomics Accelerator to Cambridge, UK", 5/29/2019 84763A10  BW   Spectrum Pharmaceuticals to Present Corporate Update at the Jefferies 2019 Global Healthcare Conference on June 5th, 9/14/2017 ENDP-US  BW   IMPORTANT INVESTOR ALERT: Khang & Khang LLP Announces Securities Class Action Lawsuit against Endo International plc and Encourages Investors with Losses to Contact the Firm,10/31/2019 ARWR-US  BW   Arrowhead Pharmaceuticals Presents Preclinical Data on ARO-ENaC at the North American Cystic Fibrosis Conference, 9/07/2010 09060J10 BW   BioDelivery Sciences Adds New Executive to Lead Business and Strategic Development,#N/A, 6/25/2012 063WMX-E BW   NextBio and Cancer Care Institute Form Strategic Partnership Focused on Clinical Use of Genomics," 1/16/2015 82691710 BW   SIGA Technologies, Inc. Appeals Judgment of Delaware Court of Chancery"
" 7/01/2019 LGND-US   BW   ZULRESSO™ (brexanolone) CIV, a Product for Treating Postpartum Depression Using Ligand’s Captisol® in its Formulation, Launched by Sage Therapeutics", 9/29/2014 74318710    BW   FDA Approves RELISTOR® Subcutaneous Injection for the Treatment of Opioid-Induced Constipation in Patients with Chronic Non-cancer Pain, 7/11/2019 45232710    BW   Illumina Reports Preliminary Revenue for Second Quarter of Fiscal Year 2019, 5/28/2019 84763A10  BW   Spectrum Announces Poziotinib ZENITH20 Trial HER2 Cohort (Cohort 2) Has Reached Enrollment Target, 9/13/2017 ENDP-US  BW   IMPORTANT SHAREHOLDER ALERT: Lundin Law PC Announces Securities Class Action Lawsuit against Endo International plc and Encourages Investors with Losses to Contact the Firm,10/18/2019 ARWR-US  BW   Arrowhead Pharmaceuticals Hosts R&D Day on Emerging Pipeline of RNAi Therapeutics, 9/02/2010 09060J10 BW   BioDelivery Sciences Announces Positive Meeting with FDA on a Streamlined ONSOLIS REMS with Broadened Distribution,#N/A, 6/22/2012 07G69B-E BW   Research and Markets: Gout Therapeutics - Pipeline Assessment and Market Forecasts to 2019," 1/07/2015 82691710 BW   Delaware Court Decision Regarding SIGA Technologies, Inc."
 6/12/2019 LGND-US   BW   Ligand Subsidiary Vernalis and PhoreMost Limited Announce Drug Discovery Collaboration for Novel Oncology Target," 8/11/2014 74318710    BW   FDA Assigns September 29, 2014 Prescription Drug User Fee Act Goal Date for RELISTOR® Subcutaneous Injection sNDA for the Treatment of Opioid-induced Constipation in Patients with Chronic Non-cancer Pain"," 6/28/2019 GNOM.XX2-US BW   Illumina Files Patent Infringement Suits Related to BGI in Switzerland, Turkey and the US", 5/16/2019 84763A10  BW   Spectrum Pharmaceuticals to Present Corporate Update at the 20th Annual B. Riley FBR Investor Conference on May 23rd," 9/13/2017 ENDP-US  BW   ENDP EQUITY ALERT: The Law Offices of Vincent Wong Notifies Investors of Commencement of a Class Action Involving Endo International plc and a Lead Plaintiff Deadline of October 17, 2017",10/02/2019 ARWR-US  BW   Arrowhead Pharmaceuticals to Host R&D Day on Emerging Pipeline of RNAi Therapeutics, 8/30/2010 09060J10 BW   BEMA Buprenorphine Phase 2 Study Results Selected for Presentation at Pain Week 2010,#N/A, 5/31/2012 07GVF3-E BW   Research and Markets: Retinal Vein Occlusion Therapeutics - Pipeline Assessment and Market Forecasts to 2019," 9/17/2014 82691710 BW   SIGA Technologies, Inc. Receives Bankruptcy Court Approval for First-Day Motions in Connection with Chapter 11 Case"
 5/17/2019 LGND-US   BW   Ligand Licenses VER250840 to Cumulus Oncology, 7/14/2014 74318710    BW   FDA Office of Drug Evaluation III Approves Salix’s Request that the FDA Approve the RELISTOR® Subcutaneous Injection sNDA for the Treatment of Opioid-induced Constipation in Patients with Chronic Non-cancer Pain," 6/17/2019 45232710    BW   Illumina Wins Infringement Suit Against Ariosa Diagnostics, Inc.", 5/09/2019 84763A10  BW   Spectrum Pharmaceuticals Reports First Quarter 2019 Financial Results and Pipeline Update, 9/12/2017 ENDP-US  BW   INVESTOR ALERT: Goldberg Law PC Announces the Filing of a Securities Class Action Lawsuit against Endo International plc, 9/30/2019 ARWR-US  BW   Arrowhead Pharmaceuticals to Participate in Upcoming October 2019 Conferences, 8/10/2010 09060J10 BW   BioDelivery Sciences to Present at the Bank of America Merrill Lynch 2010 Specialty Pharmaceuticals Conference,#N/A, 5/30/2012 060RWY-E BW   Russia’s Colorectal Cancer Drug Market Projected to Grow to More Than $480 Million in 2016," 9/16/2014 82691710 BW   SIGA Technologies, Inc. Files for Chapter 11 Reorganization"
" 5/06/2019 LGND-US   BW   Ligand Acquires Milestone and Royalty Rights to SB206 from Novan, Inc.", 6/12/2014 PGNX-US     BW   FDA Ad Comm Provides Recommendations Regarding the Potential Cardiovascular Risk Associated with the Class of Peripherally-active Opioid Receptor Antagonists and the Trials to Support Approval of Products for OIC," 6/04/2019 45232710    BW   Illumina Introduces Expanded Version of VeriSeq™ NIPT Solution, Offering More Comprehensive Detection of Rare Chromosomal Conditions", 5/09/2019 0GHV9Q-E  BW   Spectrum Announces Asset Purchase and License for a Novel Immuno-Oncology Platform including Two Early Stage Assets, 9/08/2017 ENDP-US  BW   EQUITY ALERT: Rosen Law Firm Announces Filing of Securities Class Action Lawsuit Against Endo International plc – ENDP, 9/20/2019 ARWR-US  BW   Arrowhead Pharmaceuticals Reports Inducement Grants under NASDAQ Marketplace Rule 5635(c)(4), 5/27/2010 09060J10 BW   BioDelivery Sciences Announces Commercial Partnership for BEMA Fentanyl in South Korea,#N/A, 9/26/2011 09W3PW-E BW   Impact of CATT Study Findings Evident in Significant Reported Changes in Prescribing of Genentech’s Avastin and Lucentis for the Treatment of Wet AMD According to a BioTrends Report, 4/23/2014 0CFKXC-E BW   BioSurplus To Auction Lab Equipment from SIGA Technologies
 5/02/2019 LGND-US   BW   Ligand Reports First Quarter 2019 Financial Results, 4/22/2014 74318710    BW   Salix Pharmaceuticals and Progenics Pharmaceuticals Announce the Acceptance of Submission to Expand the Use of RELISTOR in Chronic Non-Cancer Pain by the European Medicines Agency, 5/29/2019 45232710    BW   Illumina to Webcast Upcoming Investor Conference Presentation, 5/02/2019 84763A10  BW   Spectrum Pharmaceuticals Announces First Quarter 2019 Financial Results Conference Call, 9/05/2017 ENDP-US  BW   The Klein Law Firm Reminds Investors of an Investigation Concerning Possible Violations of Federal Securities Laws by Endo International plc, 9/16/2019 ARWR-US  BW   Arrowhead Pharmaceuticals Presents Initial Top-Line Clinical Data and Preclinical Data on RNAi Candidates ARO-APOC3 and ARO-ANG3, 5/26/2010 09060J10 BW   BioDelivery Sciences to Host Analyst & Investor Day June 3rd in New York City,#N/A, 9/23/2011 07GVF3-E BW   Research and Markets: Macular Degeneration Therapeutics - Pipeline Assessment and Market Forecasts to 2018,11/08/2011 09ZX1M-E BW
